{
  "generated_at": "2026-07-23T14:18:18+00:00",
  "source_output_dir": "output",
  "documents": [
    {
      "id": "RZHP_43_3_ZLATAR, 15-36",
      "source": "input\\RZHP_43_3_ZLATAR, 15-36.pdf",
      "entity_count": 22
    },
    {
      "id": "RZHP_43_4_COSIC, 37-56",
      "source": "input\\RZHP_43_4_COSIC, 37-56.pdf",
      "entity_count": 21
    },
    {
      "id": "RZHP_43_5_CIRKOVIC, 57-64",
      "source": "input\\RZHP_43_5_CIRKOVIC, 57-64.pdf",
      "entity_count": 29
    },
    {
      "id": "RZHP_43_6_BUJAN, 65-80",
      "source": "input\\RZHP_43_6_BUJAN, 65-80.pdf",
      "entity_count": 24
    },
    {
      "id": "RZHP_43_7_HUSIC, 81-95",
      "source": "input\\RZHP_43_7_HUSIC, 81-95.pdf",
      "entity_count": 20
    }
  ],
  "skipped_files": [],
  "ambiguous_local_matches": [],
  "groups": [
    {
      "id": "group-0001",
      "representative_name": "Mavro Orbini",
      "representative_type": "PERSON",
      "type_conflict": false,
      "documents": [
        "RZHP_43_3_ZLATAR, 15-36",
        "RZHP_43_4_COSIC, 37-56",
        "RZHP_43_5_CIRKOVIC, 57-64",
        "RZHP_43_6_BUJAN, 65-80",
        "RZHP_43_7_HUSIC, 81-95"
      ],
      "members": [
        {
          "document": "RZHP_43_3_ZLATAR, 15-36",
          "local_name": "Mavro Orbini",
          "local_type": "PERSON",
          "local_mentions": [
            "Orbini",
            "Mauro Orbini",
            "Orbin"
          ]
        },
        {
          "document": "RZHP_43_4_COSIC, 37-56",
          "local_name": "Mavro Orbini",
          "local_type": "PERSON",
          "local_mentions": [
            "Orbini",
            "dum Mavro",
            "don Mauro Orbini"
          ]
        },
        {
          "document": "RZHP_43_5_CIRKOVIC, 57-64",
          "local_name": "Mavro Orbin",
          "local_type": "PERSON",
          "local_mentions": [
            "Mauro Orbini",
            "Orbin",
            "Orbini"
          ]
        },
        {
          "document": "RZHP_43_6_BUJAN, 65-80",
          "local_name": "Mavro Orbini",
          "local_type": "PERSON",
          "local_mentions": [
            "Orbini",
            "Mauro Orbini",
            "benediktinac iz 16. stoljeća"
          ]
        },
        {
          "document": "RZHP_43_7_HUSIC, 81-95",
          "local_name": "Mavro Orbini",
          "local_type": "PERSON",
          "local_mentions": [
            "Orbini",
            "Opat"
          ]
        }
      ],
      "link_evidence": [
        {
          "surface_form": "mauro orbini",
          "documents": [
            "RZHP_43_3_ZLATAR, 15-36",
            "RZHP_43_5_CIRKOVIC, 57-64"
          ]
        },
        {
          "surface_form": "mauro orbini",
          "documents": [
            "RZHP_43_5_CIRKOVIC, 57-64",
            "RZHP_43_6_BUJAN, 65-80"
          ]
        },
        {
          "surface_form": "orbini",
          "documents": [
            "RZHP_43_3_ZLATAR, 15-36",
            "RZHP_43_4_COSIC, 37-56"
          ]
        },
        {
          "surface_form": "orbini",
          "documents": [
            "RZHP_43_4_COSIC, 37-56",
            "RZHP_43_5_CIRKOVIC, 57-64"
          ]
        },
        {
          "surface_form": "orbini",
          "documents": [
            "RZHP_43_5_CIRKOVIC, 57-64",
            "RZHP_43_6_BUJAN, 65-80"
          ]
        },
        {
          "surface_form": "orbini",
          "documents": [
            "RZHP_43_6_BUJAN, 65-80",
            "RZHP_43_7_HUSIC, 81-95"
          ]
        },
        {
          "surface_form": "orbin",
          "documents": [
            "RZHP_43_3_ZLATAR, 15-36",
            "RZHP_43_5_CIRKOVIC, 57-64"
          ]
        },
        {
          "surface_form": "mavro orbini",
          "documents": [
            "RZHP_43_3_ZLATAR, 15-36",
            "RZHP_43_4_COSIC, 37-56"
          ]
        },
        {
          "surface_form": "mavro orbini",
          "documents": [
            "RZHP_43_4_COSIC, 37-56",
            "RZHP_43_6_BUJAN, 65-80"
          ]
        },
        {
          "surface_form": "mavro orbini",
          "documents": [
            "RZHP_43_6_BUJAN, 65-80",
            "RZHP_43_7_HUSIC, 81-95"
          ]
        }
      ]
    },
    {
      "id": "group-0002",
      "representative_name": "Rè di Dalmatia et altri luoghi vicini dell'Illrico dall'anno del Signore 495. Finna 1161",
      "representative_type": "PRODUCT",
      "type_conflict": false,
      "documents": [
        "RZHP_43_3_ZLATAR, 15-36",
        "RZHP_43_4_COSIC, 37-56",
        "RZHP_43_5_CIRKOVIC, 57-64",
        "RZHP_43_6_BUJAN, 65-80",
        "RZHP_43_7_HUSIC, 81-95"
      ],
      "members": [
        {
          "document": "RZHP_43_3_ZLATAR, 15-36",
          "local_name": "Kraljevstvo Slavena",
          "local_type": "PRODUCT",
          "local_mentions": [
            "Il regno degli Slavi",
            "The Kingdom of the Slavs",
            "Kraljevstvo Slavena – Il regno degli Slavi"
          ]
        },
        {
          "document": "RZHP_43_4_COSIC, 37-56",
          "local_name": "Il Regno degli Slavi",
          "local_type": "PRODUCT",
          "local_mentions": [
            "Kraljevstvo Slavena",
            "Kingdom of Slavs",
            "Kraljevstvo Slovena"
          ]
        },
        {
          "document": "RZHP_43_5_CIRKOVIC, 57-64",
          "local_name": "Kraljevstvo Slovena",
          "local_type": "PRODUCT",
          "local_mentions": [
            "Il Regno degli Slavi",
            "The Kingdom of Slavs",
            "Kraljevstvo Slavena"
          ]
        },
        {
          "document": "RZHP_43_6_BUJAN, 65-80",
          "local_name": "Rè di Dalmatia et altri luoghi vicini dell'Illrico dall'anno del Signore 495. Finna 1161",
          "local_type": "PRODUCT",
          "local_mentions": [
            "Rè di Dalmatia",
            "Il Regno de gli Slavi",
            "Regno de gli Slavi",
            "Kraljevstvo Slavena"
          ]
        },
        {
          "document": "RZHP_43_7_HUSIC, 81-95",
          "local_name": "Kraljevstvo Slavena",
          "local_type": "PRODUCT",
          "local_mentions": [
            "Il Regno de gli Slavi",
            "The Realm of the Slavs"
          ]
        }
      ],
      "link_evidence": [
        {
          "surface_form": "il regno degli slavi",
          "documents": [
            "RZHP_43_3_ZLATAR, 15-36",
            "RZHP_43_4_COSIC, 37-56"
          ]
        },
        {
          "surface_form": "il regno degli slavi",
          "documents": [
            "RZHP_43_4_COSIC, 37-56",
            "RZHP_43_5_CIRKOVIC, 57-64"
          ]
        },
        {
          "surface_form": "kraljevstvo slavena",
          "documents": [
            "RZHP_43_3_ZLATAR, 15-36",
            "RZHP_43_4_COSIC, 37-56"
          ]
        },
        {
          "surface_form": "kraljevstvo slavena",
          "documents": [
            "RZHP_43_4_COSIC, 37-56",
            "RZHP_43_5_CIRKOVIC, 57-64"
          ]
        },
        {
          "surface_form": "kraljevstvo slavena",
          "documents": [
            "RZHP_43_5_CIRKOVIC, 57-64",
            "RZHP_43_6_BUJAN, 65-80"
          ]
        },
        {
          "surface_form": "kraljevstvo slavena",
          "documents": [
            "RZHP_43_6_BUJAN, 65-80",
            "RZHP_43_7_HUSIC, 81-95"
          ]
        },
        {
          "surface_form": "kraljevstvo slovena",
          "documents": [
            "RZHP_43_4_COSIC, 37-56",
            "RZHP_43_5_CIRKOVIC, 57-64"
          ]
        },
        {
          "surface_form": "il regno de gli slavi",
          "documents": [
            "RZHP_43_6_BUJAN, 65-80",
            "RZHP_43_7_HUSIC, 81-95"
          ]
        }
      ]
    },
    {
      "id": "group-0003",
      "representative_name": "Dubrovačka Republika",
      "representative_type": "ORGANIZATION",
      "type_conflict": true,
      "documents": [
        "RZHP_43_3_ZLATAR, 15-36",
        "RZHP_43_4_COSIC, 37-56",
        "RZHP_43_6_BUJAN, 65-80",
        "RZHP_43_7_HUSIC, 81-95"
      ],
      "members": [
        {
          "document": "RZHP_43_3_ZLATAR, 15-36",
          "local_name": "Dubrovačka Republika",
          "local_type": "ORGANIZATION",
          "local_mentions": [
            "Republic of Dubrovnik",
            "Dubrovnik"
          ]
        },
        {
          "document": "RZHP_43_4_COSIC, 37-56",
          "local_name": "Dubrovačka Republika",
          "local_type": "LOCATION",
          "local_mentions": [
            "Dubrovnik",
            "Republika",
            "Ragusa",
            "Dubrovnik Republic"
          ]
        },
        {
          "document": "RZHP_43_6_BUJAN, 65-80",
          "local_name": "Dubrovnik",
          "local_type": "LOCATION",
          "local_mentions": [
            "Ragusa",
            "Rhacusa",
            "dubrovačka"
          ]
        },
        {
          "document": "RZHP_43_7_HUSIC, 81-95",
          "local_name": "Dubrovnik",
          "local_type": "LOCATION",
          "local_mentions": [
            "Ragusa"
          ]
        }
      ],
      "link_evidence": [
        {
          "surface_form": "dubrovačka republika",
          "documents": [
            "RZHP_43_3_ZLATAR, 15-36",
            "RZHP_43_4_COSIC, 37-56"
          ]
        },
        {
          "surface_form": "dubrovnik",
          "documents": [
            "RZHP_43_3_ZLATAR, 15-36",
            "RZHP_43_4_COSIC, 37-56"
          ]
        },
        {
          "surface_form": "dubrovnik",
          "documents": [
            "RZHP_43_4_COSIC, 37-56",
            "RZHP_43_6_BUJAN, 65-80"
          ]
        },
        {
          "surface_form": "dubrovnik",
          "documents": [
            "RZHP_43_6_BUJAN, 65-80",
            "RZHP_43_7_HUSIC, 81-95"
          ]
        },
        {
          "surface_form": "ragusa",
          "documents": [